<?xml version="1.0" encoding="UTF-8" standalone="yes"?><root xmlns:xsi="http://www.w3.org/2001/XMLSchema-instance" xsi:noNamespaceSchemaLocation="plajlisty.xsd"><metadane><autor><imie>Wiktor</imie><nazwisko>Muraszko</nazwisko><nr_indeksu>210281</nr_indeksu></autor><autor><imie>Wojciech</imie><nazwisko>Mosieński</nazwisko><nr_indeksu>210280</nr_indeksu></autor><data_modyfikacji>2019-03-29</data_modyfikacji></metadane><lista_gatunkow><gatunek id="Rock">Rock</gatunek><gatunek id="Pop">Pop</gatunek><gatunek id="Alternatywna">Alternatywna</gatunek><gatunek id="eloasd">ddddddd</gatunek></lista_gatunkow><lista_wykonawcow><wykonawca id="GNR" nazwa="Guns N’ Rosesdsadsa"><artysta><imie>Axldd</imie><nazwisko>Rosedd</nazwisko></artysta><artysta pseudo="Slashaa"><imie>Souldd</imie><nazwisko>Hudsondd</nazwisko></artysta><artysta pseudo="asd"><imie>Izzy</imie><nazwisko>Stradlin</nazwisko></artysta></wykonawca><wykonawca id="MT" nazwa="Modern Talkingddddd"><artysta><imie>Dieter</imie><nazwisko>Bohlen</nazwisko></artysta><artysta><imie>Thomas</imie><nazwisko>Anders</nazwisko></artysta></wykonawca><wykonawca id="qwe" nazwa="ewq"><artysta pseudo=""><imie>q1</imie><nazwisko>w2</nazwisko></artysta><artysta pseudo=""><imie>elo</imie><nazwisko>sd</nazwisko></artysta></wykonawca></lista_wykonawcow><lista_piosenek><piosenka tytul="It's So Easyfdsafdsaf" nastroj="wesola" gatunek="Rock" wykonawca="GNR"><czas_trwania>3:23</czas_trwania><album>Appetite for Destruction</album><rok_wydania>1987</rok_wydania></piosenka><piosenka tytul="Nighttrain" nastroj="mieszana" gatunek="Alternatywna" wykonawca="MT"><czas_trwania>4:29</czas_trwania><album>Appetite for Destructionddddddd</album><rok_wydania>1987</rok_wydania></piosenka><piosenka tytul="Out Ta Get Me" nastroj="mieszana" gatunek="Rock" wykonawca="GNR"><czas_trwania>4:25</czas_trwania><album>Appetite for Destruction</album><rok_wydania>1233</rok_wydania></piosenka><piosenka tytul="Mr. Brownstone" nastroj="smutna" gatunek="Rock" wykonawca="GNR"><czas_trwania>3:49</czas_trwania><album>Appetite for Destruction</album><rok_wydania>1987</rok_wydania></piosenka><piosenka tytul="Paradise City" nastroj="wesola" gatunek="Rock" wykonawca="GNR"><czas_trwania>6:46</czas_trwania><album>Appetite for Destruction</album><rok_wydania>1987</rok_wydania></piosenka><piosenka tytul="My Michelle" nastroj="niezidentyfikowana" gatunek="Rock" wykonawca="GNR"><czas_trwania>3:40</czas_trwania><album>Appetite for Destruction</album><rok_wydania>1987</rok_wydania></piosenka><piosenka tytul="Think About You" nastroj="smutna" gatunek="Rock" wykonawca="GNR"><czas_trwania>3:52</czas_trwania><album>Appetite for Destruction</album><rok_wydania>1987</rok_wydania></piosenka><piosenka tytul="Sweet Child O' Mine" nastroj="smutna" gatunek="Rock" wykonawca="GNR"><czas_trwania>5:55</czas_trwania><album>Appetite for Destruction</album><rok_wydania>1987</rok_wydania></piosenka><piosenka tytul="You're Crazy" nastroj="wesola" gatunek="Rock" wykonawca="GNR"><czas_trwania>3:17</czas_trwania><album>Appetite for Destruction</album><rok_wydania>1987</rok_wydania></piosenka><piosenka tytul="Anything Goes" nastroj="wesola" gatunek="Rock" wykonawca="GNR"><czas_trwania>3:26</czas_trwania><album>Appetite for Destruction</album><rok_wydania>1987</rok_wydania></piosenka><piosenka tytul="Rocet Queen" nastroj="wesola" gatunek="Rock" wykonawca="GNR"><czas_trwania>3:40</czas_trwania><album>Appetite for Destruction</album><rok_wydania>1987</rok_wydania></piosenka><piosenka tytul="Brother Louie" nastroj="smutna" gatunek="Pop" wykonawca="MT"><czas_trwania>3:41</czas_trwania><album>Ready for Romance</album><rok_wydania>1986</rok_wydania></piosenka><piosenka tytul="Just We Two" nastroj="smutna" gatunek="Pop" wykonawca="MT"><czas_trwania>3:54</czas_trwania><album>Ready for Romance</album><rok_wydania>1986</rok_wydania></piosenka><piosenka tytul="Lady Lai" nastroj="smutna" gatunek="Pop" wykonawca="MT"><czas_trwania>4:55</czas_trwania><album>Ready for Romance</album><rok_wydania>1986</rok_wydania></piosenka><piosenka tytul="Doctor for My Heart" nastroj="niezidentyfikowana" gatunek="Pop" wykonawca="MT"><czas_trwania>3:16</czas_trwania><album>Ready for Romance</album><rok_wydania>1986</rok_wydania></piosenka><piosenka tytul="Save Me - Don't Break Me" nastroj="smutna" gatunek="Pop" wykonawca="MT"><czas_trwania>3:45</czas_trwania><album>Ready for Romance</album><rok_wydania>1986</rok_wydania></piosenka><piosenka tytul="Atlantis Is Calling" nastroj="niezidentyfikowana" gatunek="Pop" wykonawca="MT"><czas_trwania>3:48</czas_trwania><album>Ready for Romance</album><rok_wydania>1986</rok_wydania></piosenka><piosenka tytul="Keep Lova Alive" nastroj="smutna" gatunek="Pop" wykonawca="MT"><czas_trwania>3:25</czas_trwania><album>Ready for Romance</album><rok_wydania>1986</rok_wydania></piosenka><piosenka tytul="Hey You" nastroj="niezidentyfikowana" gatunek="Pop" wykonawca="MT"><czas_trwania>3:20</czas_trwania><album>Ready for Romance</album><rok_wydania>1986</rok_wydania></piosenka><piosenka tytul="Angie's Heart" nastroj="mieszana" gatunek="Pop" wykonawca="MT"><czas_trwania>3:37</czas_trwania><album>Ready for Romance</album><rok_wydania>1986</rok_wydania></piosenka><piosenka tytul="Only Love Can Break My Heart" nastroj="smutna" gatunek="Pop" wykonawca="MT"><czas_trwania>3:35</czas_trwania><album>Ready for Romance</album><rok_wydania>1986</rok_wydania></piosenka><piosenka tytul="asfdsafdsaf" nastroj="mieszana" gatunek="eloasd" wykonawca="qwe"><czas_trwania>4:29</czas_trwania><album>Appetite for Destructionddddddd</album><rok_wydania>1987</rok_wydania></piosenka><piosenka tytul="asfdselo" nastroj="niezidentyfikowana" gatunek="eloasd" wykonawca="qwe"><czas_trwania>4:29</czas_trwania><album>Adasd</album><rok_wydania>1987</rok_wydania></piosenka></lista_piosenek><plajlista nazwa="Guns'i A4Dddddddd"><piosenkaRef tytulRef="Out Ta Get Me"/><piosenkaRef tytulRef="Paradise City"/><piosenkaRef tytulRef="My Michelle"/><piosenkaRef tytulRef="Think About You"/><piosenkaRef tytulRef="Sweet Child O' Mine"/><piosenkaRef tytulRef="You're Crazy"/><piosenkaRef tytulRef="Anything Goes"/><piosenkaRef tytulRef="Rocet Queen"/></plajlista><plajlista nazwa="Eternal Romance"><piosenkaRef tytulRef="Brother Louie"/><piosenkaRef tytulRef="Just We Two"/><piosenkaRef tytulRef="Lady Lai"/><piosenkaRef tytulRef="Doctor for My Heart"/><piosenkaRef tytulRef="Save Me - Don't Break Me"/><piosenkaRef tytulRef="Atlantis Is Calling"/><piosenkaRef tytulRef="Keep Lova Alive"/><piosenkaRef tytulRef="Hey You"/><piosenkaRef tytulRef="Angie's Heart"/><piosenkaRef tytulRef="Only Love Can Break My Heart"/></plajlista><plajlista nazwa="elo"><piosenkaRef tytulRef="Out Ta Get Me"/><piosenkaRef tytulRef="Out Ta Get Me"/><piosenkaRef tytulRef="Out Ta Get Me"/><piosenkaRef tytulRef="Out Ta Get Me"/><piosenkaRef tytulRef="Out Ta Get Me"/><piosenkaRef tytulRef="Out Ta Get Me"/><piosenkaRef tytulRef="Out Ta Get Me"/><piosenkaRef tytulRef="Out Ta Get Me"/><piosenkaRef tytulRef="Out Ta Get Me"/><piosenkaRef tytulRef="asfdsafdsaf"/><piosenkaRef tytulRef="asfdselo"/></plajlista></root>